{
  "id": "20261017-000228_derive_HAUS-HGL-02-hagelschaden-reihenhaus-ostring",
  "skill": "derive",
  "container": "30-review-human/HAUS-HGL-02-hagelschaden-reihenhaus-ostring",
  "requested_by": "alex",
  "runner": "claude-code",
  "status": "done",
  "created": "2026-10-17T00:02:28+02:00",
  "started": "2026-10-17T00:02:48+02:00",
  "taken_by": "alex@studio",
  "finished": "2026-10-17T00:05:58+02:00",
  "exit": 0,
  "log": "_runs/20261017-000228_derive_HAUS-HGL-02-hagelschaden-reihenhaus-ostring.log",
  "model": "claude-opus-5-5",
  "turns": 16,
  "duration_s": 190.0,
  "cost_usd": 1.0,
  "result": "Done. The deliverables are in the folder."
}
