{
  "id": "20261020-212713_interpret_FN-045-what-the-pilot-taught-us",
  "skill": "interpret",
  "container": "15-interpretation/FN-045-what-the-pilot-taught-us",
  "requested_by": "alex",
  "runner": "claude-code",
  "status": "running",
  "created": "2026-10-20T21:27:13+02:00",
  "note": "Take the debrief notes as the base.",
  "started": "2026-10-20T21:27:33+02:00",
  "taken_by": "alex@studio"
}
