{
  "id": "20261020-202728_interpret_KFZ-0821-motorschaden-nach-reparatur",
  "skill": "interpret",
  "container": "10-ideas/KFZ-0821-motorschaden-nach-reparatur",
  "requested_by": "alex",
  "runner": "claude-code",
  "status": "failed",
  "created": "2026-10-20T20:27:28+02:00",
  "note": "Streitpunkt zuerst benennen.",
  "started": "2026-10-20T20:27:48+02:00",
  "taken_by": "alex@studio",
  "finished": "2026-10-20T20:29:02+02:00",
  "exit": 1,
  "log": "_runs/20261020-202728_interpret_KFZ-0821-motorschaden-nach-reparatur.log",
  "model": "claude-opus-5-5",
  "turns": 8,
  "duration_s": 74.0,
  "cost_usd": 0.28,
  "result": "Stopped: the source material is too thin to interpret. Add a paragraph and run again."
}
