{
  "id": "20261020-181227_interpret_SP-032-the-fourth-reviewer",
  "skill": "interpret",
  "container": "20-produce/SP-032-the-fourth-reviewer",
  "requested_by": "alex",
  "runner": "claude-code",
  "status": "done",
  "created": "2026-10-20T18:12:27+02:00",
  "started": "2026-10-20T18:12:47+02:00",
  "taken_by": "alex@studio",
  "finished": "2026-10-20T18:15:38+02:00",
  "exit": 0,
  "log": "_runs/20261020-181227_interpret_SP-032-the-fourth-reviewer.log",
  "model": "claude-opus-5-5",
  "turns": 14,
  "duration_s": 171.4,
  "cost_usd": 0.92,
  "result": "Done. The deliverables are in the folder."
}
