{
  "id": "20261017-214228_interpret_HAUS-0416-wasserschaden-badezimmer",
  "skill": "interpret",
  "container": "30-review-human/HAUS-0416-wasserschaden-badezimmer",
  "requested_by": "alex",
  "runner": "claude-code",
  "status": "done",
  "created": "2026-10-17T21:42:28+02:00",
  "note": "Als Gutachten, nicht als Bericht.",
  "started": "2026-10-17T21:42:48+02:00",
  "taken_by": "alex@studio",
  "finished": "2026-10-17T21:49:16+02:00",
  "exit": 0,
  "log": "_runs/20261017-214228_interpret_HAUS-0416-wasserschaden-badezimmer.log",
  "model": "claude-opus-5-5",
  "turns": 29,
  "duration_s": 388.0,
  "cost_usd": 2.4,
  "result": "Done. The deliverables are in the folder."
}
