{
  "id": "20261009-185113_interpret_FN-042-seven-checks-before-merge",
  "skill": "interpret",
  "container": "55-scheduled/FN-042-seven-checks-before-merge",
  "requested_by": "alex",
  "runner": "claude-code",
  "status": "done",
  "created": "2026-10-09T18:51:13+02:00",
  "started": "2026-10-09T18:51:33+02:00",
  "taken_by": "alex@studio",
  "finished": "2026-10-09T18:57:03+02:00",
  "exit": 0,
  "log": "_runs/20261009-185113_interpret_FN-042-seven-checks-before-merge.log",
  "model": "claude-opus-5-5",
  "turns": 27,
  "duration_s": 330.0,
  "cost_usd": 2.1,
  "result": "Done. The deliverables are in the folder."
}
