{
  "id": "20261009-185114_interpret_KFZ-0812-totalschaden-motorrad",
  "skill": "interpret",
  "container": "55-scheduled/KFZ-0812-totalschaden-motorrad",
  "requested_by": "alex",
  "runner": "claude-code",
  "status": "done",
  "created": "2026-10-09T18:51:14+02:00",
  "started": "2026-10-09T18:51:34+02:00",
  "taken_by": "alex@studio",
  "finished": "2026-10-09T18:56:44+02:00",
  "exit": 0,
  "log": "_runs/20261009-185114_interpret_KFZ-0812-totalschaden-motorrad.log",
  "model": "claude-opus-5-5",
  "turns": 26,
  "duration_s": 310.0,
  "cost_usd": 2.0,
  "result": "Done. The deliverables are in the folder."
}
