{
  "id": "20261012-132228_interpret_HAUS-0410-sturmschaden-gartenhaus",
  "skill": "interpret",
  "container": "50-ready-to-publish/HAUS-0410-sturmschaden-gartenhaus",
  "requested_by": "alex",
  "runner": "claude-code",
  "status": "done",
  "created": "2026-10-12T13:22:28+02:00",
  "started": "2026-10-12T13:22:48+02:00",
  "taken_by": "alex@studio",
  "finished": "2026-10-12T13:26:48+02:00",
  "exit": 0,
  "log": "_runs/20261012-132228_interpret_HAUS-0410-sturmschaden-gartenhaus.log",
  "model": "claude-opus-5-5",
  "turns": 20,
  "duration_s": 240.0,
  "cost_usd": 1.7,
  "result": "Done. The deliverables are in the folder."
}
