{
  "id": "20261017-215113_interpret_FN-043-the-review-that-reads-itself",
  "skill": "interpret",
  "container": "30-review-human/FN-043-the-review-that-reads-itself",
  "requested_by": "alex",
  "runner": "claude-code",
  "status": "done",
  "created": "2026-10-17T21:51:13+02:00",
  "note": "Make it an essay, not a report.",
  "started": "2026-10-17T21:51:33+02:00",
  "taken_by": "alex@studio",
  "finished": "2026-10-17T21:58:25+02:00",
  "exit": 0,
  "log": "_runs/20261017-215113_interpret_FN-043-the-review-that-reads-itself.log",
  "model": "claude-opus-5-5",
  "turns": 31,
  "duration_s": 412.6,
  "cost_usd": 2.4,
  "result": "Done. The deliverables are in the folder."
}
