{
  "id": "20261020-203613_interpret_WN-009-notes-on-friction",
  "skill": "interpret",
  "container": "10-ideas/WN-009-notes-on-friction",
  "requested_by": "alex",
  "runner": "claude-code",
  "status": "failed",
  "created": "2026-10-20T20:36:13+02:00",
  "note": "Start from the three examples.",
  "started": "2026-10-20T20:36:33+02:00",
  "taken_by": "alex@studio",
  "finished": "2026-10-20T20:38:01+02:00",
  "exit": 1,
  "log": "_runs/20261020-203613_interpret_WN-009-notes-on-friction.log",
  "model": "claude-opus-5-5",
  "turns": 9,
  "duration_s": 88.0,
  "cost_usd": 0.31,
  "result": "Stopped: the source material is too thin to interpret. Add a paragraph and run again."
}
