{
  "id": "20261017-001113_derive_POD-ARC-02-the-arc-spoken",
  "skill": "derive",
  "container": "30-review-human/POD-ARC-02-the-arc-spoken",
  "requested_by": "alex",
  "runner": "claude-code",
  "status": "done",
  "created": "2026-10-17T00:11:13+02:00",
  "started": "2026-10-17T00:11:33+02:00",
  "taken_by": "alex@studio",
  "finished": "2026-10-17T00:14:58+02:00",
  "exit": 0,
  "log": "_runs/20261017-001113_derive_POD-ARC-02-the-arc-spoken.log",
  "model": "claude-opus-5-5",
  "turns": 18,
  "duration_s": 205.0,
  "cost_usd": 1.1,
  "result": "Done. The deliverables are in the folder."
}
