{
  "id": "20261012-133113_interpret_FN-040-the-boring-governance-win",
  "skill": "interpret",
  "container": "50-ready-to-publish/FN-040-the-boring-governance-win",
  "requested_by": "alex",
  "runner": "claude-code",
  "status": "done",
  "created": "2026-10-12T13:31:13+02:00",
  "started": "2026-10-12T13:31:33+02:00",
  "taken_by": "alex@studio",
  "finished": "2026-10-12T13:35:53+02:00",
  "exit": 0,
  "log": "_runs/20261012-133113_interpret_FN-040-the-boring-governance-win.log",
  "model": "claude-opus-5-5",
  "turns": 22,
  "duration_s": 260.0,
  "cost_usd": 1.9,
  "result": "Done. The deliverables are in the folder."
}
